{"candidate":{"workflowId":"prop:b02617f1f9382f7e"},"generatedAt":"2026-09-01T09:45:01.289Z","inventory":{"byDisposition":{"extracted":82,"unextracted-with-reason":23,"unsafe":0,"unsupported":0},"totalRows":105},"rows":[{"disposition":"unextracted-with-reason","domain":"uncategorized","evidence":{"runtimeForms":[],"runtimeObservationCount":0,"runtimeUrls":[],"sourceRefs":[]},"intents":[],"inventoryKey":"* source-parse-error:api/src/ai/mcp/server.test.ts","oracleKinds":["observed-only"],"reason":"source-parse-error","replayStatus":"not-attempted","surface":{"kind":"unknown","method":"*","path":"<parse-error:api/src/ai/mcp/server.test.ts>"},"truthState":"observed","verbs":[]},{"disposition":"unextracted-with-reason","domain":"uncategorized","evidence":{"runtimeForms":[],"runtimeObservationCount":0,"runtimeUrls":[],"sourceRefs":[]},"intents":[],"inventoryKey":"* source-parse-error:api/src/services/files.test.ts","oracleKinds":["observed-only"],"reason":"source-parse-error","replayStatus":"not-attempted","surface":{"kind":"unknown","method":"*","path":"<parse-error:api/src/services/files.test.ts>"},"truthState":"observed","verbs":[]},{"disposition":"unextracted-with-reason","domain":"uncategorized","evidence":{"runtimeForms":[],"runtimeObservationCount":0,"runtimeUrls":[],"sourceRefs":[]},"intents":[],"inventoryKey":"* source-parse-error:api/src/services/mcp-oauth/index.test.ts","oracleKinds":["observed-only"],"reason":"source-parse-error","replayStatus":"not-attempted","surface":{"kind":"unknown","method":"*","path":"<parse-error:api/src/services/mcp-oauth/index.test.ts>"},"truthState":"observed","verbs":[]},{"disposition":"unextracted-with-reason","domain":"uncategorized","evidence":{"runtimeForms":[],"runtimeObservationCount":0,"runtimeUrls":[],"sourceRefs":[]},"intents":[],"inventoryKey":"* source-parse-error:api/src/websocket/controllers/graphql.test.ts","oracleKinds":["observed-only"],"reason":"source-parse-error","replayStatus":"not-attempted","surface":{"kind":"unknown","method":"*","path":"<parse-error:api/src/websocket/controllers/graphql.test.ts>"},"truthState":"observed","verbs":[]},{"disposition":"unextracted-with-reason","domain":"uncategorized","evidence":{"runtimeForms":[],"runtimeObservationCount":0,"runtimeUrls":[],"sourceRefs":[]},"intents":[],"inventoryKey":"* source-parse-error:app/src/ai/components/parts/ai-tool-call-card.test.ts","oracleKinds":["observed-only"],"reason":"source-parse-error","replayStatus":"not-attempted","surface":{"kind":"unknown","method":"*","path":"<parse-error:app/src/ai/components/parts/ai-tool-call-card.test.ts>"},"truthState":"observed","verbs":[]},{"disposition":"unextracted-with-reason","domain":"uncategorized","evidence":{"runtimeForms":[],"runtimeObservationCount":0,"runtimeUrls":[],"sourceRefs":[]},"intents":[],"inventoryKey":"* source-parse-error:app/src/app.test.ts","oracleKinds":["observed-only"],"reason":"source-parse-error","replayStatus":"not-attempted","surface":{"kind":"unknown","method":"*","path":"<parse-error:app/src/app.test.ts>"},"truthState":"observed","verbs":[]},{"disposition":"unextracted-with-reason","domain":"uncategorized","evidence":{"runtimeForms":[],"runtimeObservationCount":0,"runtimeUrls":[],"sourceRefs":[]},"intents":[],"inventoryKey":"* source-parse-error:app/src/modules/settings/routes/ai/overview.test.ts","oracleKinds":["observed-only"],"reason":"source-parse-error","replayStatus":"not-attempted","surface":{"kind":"unknown","method":"*","path":"<parse-error:app/src/modules/settings/routes/ai/overview.test.ts>"},"truthState":"observed","verbs":[]},{"disposition":"unextracted-with-reason","domain":"uncategorized","evidence":{"runtimeForms":[],"runtimeObservationCount":0,"runtimeUrls":[],"sourceRefs":[]},"intents":[],"inventoryKey":"* source-parse-error:app/src/modules/visual/components/editing-layer.test.ts","oracleKinds":["observed-only"],"reason":"source-parse-error","replayStatus":"not-attempted","surface":{"kind":"unknown","method":"*","path":"<parse-error:app/src/modules/visual/components/editing-layer.test.ts>"},"truthState":"observed","verbs":[]},{"disposition":"unextracted-with-reason","domain":"uncategorized","evidence":{"runtimeForms":[],"runtimeObservationCount":0,"runtimeUrls":[],"sourceRefs":[]},"intents":[],"inventoryKey":"* source-parse-error:app/src/views/private/components/live-preview.test.ts","oracleKinds":["observed-only"],"reason":"source-parse-error","replayStatus":"not-attempted","surface":{"kind":"unknown","method":"*","path":"<parse-error:app/src/views/private/components/live-preview.test.ts>"},"truthState":"observed","verbs":[]},{"disposition":"unextracted-with-reason","domain":"uncategorized","evidence":{"runtimeForms":[],"runtimeObservationCount":0,"runtimeUrls":[],"sourceRefs":[]},"intents":[],"inventoryKey":"* source-parse-error:app/src/views/private/components/overlay-item.test.ts","oracleKinds":["observed-only"],"reason":"source-parse-error","replayStatus":"not-attempted","surface":{"kind":"unknown","method":"*","path":"<parse-error:app/src/views/private/components/overlay-item.test.ts>"},"truthState":"observed","verbs":[]},{"disposition":"unextracted-with-reason","domain":"uncategorized","evidence":{"runtimeForms":[],"runtimeObservationCount":0,"runtimeUrls":[],"sourceRefs":[]},"intents":[],"inventoryKey":"* source-parse-error:packages/env/src/utils/read-configuration-from-javascript.test.ts","oracleKinds":["observed-only"],"reason":"source-parse-error","replayStatus":"not-attempted","surface":{"kind":"unknown","method":"*","path":"<parse-error:packages/env/src/utils/read-configuration-from-javascript.test.ts>"},"truthState":"observed","verbs":[]},{"disposition":"unextracted-with-reason","domain":"uncategorized","evidence":{"runtimeForms":[],"runtimeObservationCount":0,"runtimeUrls":[],"sourceRefs":[]},"intents":[],"inventoryKey":"* source-parse-error:packages/env/src/utils/read-configuration-from-json.test.ts","oracleKinds":["observed-only"],"reason":"source-parse-error","replayStatus":"not-attempted","surface":{"kind":"unknown","method":"*","path":"<parse-error:packages/env/src/utils/read-configuration-from-json.test.ts>"},"truthState":"observed","verbs":[]},{"disposition":"unextracted-with-reason","domain":"uncategorized","evidence":{"runtimeForms":[],"runtimeObservationCount":0,"runtimeUrls":[],"sourceRefs":[]},"intents":[],"inventoryKey":"* source-parse-error:packages/extensions/src/shared/index.ts","oracleKinds":["observed-only"],"reason":"source-parse-error","replayStatus":"not-attempted","surface":{"kind":"unknown","method":"*","path":"<parse-error:packages/extensions/src/shared/index.ts>"},"truthState":"observed","verbs":[]},{"disposition":"unextracted-with-reason","domain":"uncategorized","evidence":{"runtimeForms":[],"runtimeObservationCount":0,"runtimeUrls":[],"sourceRefs":[]},"intents":[],"inventoryKey":"* source-parse-error:packages/memory/src/bus/types/index.ts","oracleKinds":["observed-only"],"reason":"source-parse-error","replayStatus":"not-attempted","surface":{"kind":"unknown","method":"*","path":"<parse-error:packages/memory/src/bus/types/index.ts>"},"truthState":"observed","verbs":[]},{"disposition":"unextracted-with-reason","domain":"uncategorized","evidence":{"runtimeForms":[],"runtimeObservationCount":0,"runtimeUrls":[],"sourceRefs":[]},"intents":[],"inventoryKey":"* source-parse-error:packages/memory/src/cache/types/index.ts","oracleKinds":["observed-only"],"reason":"source-parse-error","replayStatus":"not-attempted","surface":{"kind":"unknown","method":"*","path":"<parse-error:packages/memory/src/cache/types/index.ts>"},"truthState":"observed","verbs":[]},{"disposition":"unextracted-with-reason","domain":"uncategorized","evidence":{"runtimeForms":[],"runtimeObservationCount":0,"runtimeUrls":[],"sourceRefs":[]},"intents":[],"inventoryKey":"* source-parse-error:packages/memory/src/kv/types/index.ts","oracleKinds":["observed-only"],"reason":"source-parse-error","replayStatus":"not-attempted","surface":{"kind":"unknown","method":"*","path":"<parse-error:packages/memory/src/kv/types/index.ts>"},"truthState":"observed","verbs":[]},{"disposition":"unextracted-with-reason","domain":"uncategorized","evidence":{"runtimeForms":[],"runtimeObservationCount":0,"runtimeUrls":[],"sourceRefs":[]},"intents":[],"inventoryKey":"* source-parse-error:sdk/src/auth/index.ts","oracleKinds":["observed-only"],"reason":"source-parse-error","replayStatus":"not-attempted","surface":{"kind":"unknown","method":"*","path":"<parse-error:sdk/src/auth/index.ts>"},"truthState":"observed","verbs":[]},{"disposition":"unextracted-with-reason","domain":"uncategorized","evidence":{"runtimeForms":[],"runtimeObservationCount":0,"runtimeUrls":[],"sourceRefs":[]},"intents":[],"inventoryKey":"* source-parse-error:sdk/src/graphql/index.ts","oracleKinds":["observed-only"],"reason":"source-parse-error","replayStatus":"not-attempted","surface":{"kind":"unknown","method":"*","path":"<parse-error:sdk/src/graphql/index.ts>"},"truthState":"observed","verbs":[]},{"disposition":"unextracted-with-reason","domain":"uncategorized","evidence":{"runtimeForms":[],"runtimeObservationCount":0,"runtimeUrls":[],"sourceRefs":[]},"intents":[],"inventoryKey":"* source-parse-error:sdk/src/index.ts","oracleKinds":["observed-only"],"reason":"source-parse-error","replayStatus":"not-attempted","surface":{"kind":"unknown","method":"*","path":"<parse-error:sdk/src/index.ts>"},"truthState":"observed","verbs":[]},{"disposition":"unextracted-with-reason","domain":"uncategorized","evidence":{"runtimeForms":[],"runtimeObservationCount":0,"runtimeUrls":[],"sourceRefs":[]},"intents":[],"inventoryKey":"* source-scan-diagnostic:ARXIC-SOURCE-BINARY-FILE","oracleKinds":["observed-only"],"reason":"source-scan-diagnostic:ARXIC-SOURCE-BINARY-FILE","replayStatus":"not-attempted","surface":{"kind":"unknown","method":"*","path":"<scan-diagnostic:ARXIC-SOURCE-BINARY-FILE>"},"truthState":"observed","verbs":[]},{"disposition":"unextracted-with-reason","domain":"uncategori